{
  "version": 1,
  "corpus_id": "comesibutta-packaging-marks",
  "corpus_version": "0.1.0",
  "created_at": "2026-08-07T19:00:00+02:00",
  "taxonomy": {
    "taxonomy_id": "packaging-mark-detector",
    "taxonomy_version": "1.0.0",
    "sha256": "02a4b98bfa9975f309d52ccdb8fd35968fdd0b8a250fba29b6dbe33f3a1357c5"
  },
  "split_policy": {
    "unit": "capture_group",
    "algorithm": "sha256_mod_100",
    "seed": "comesibutta-vision-v1",
    "train": [0, 79],
    "validation": [80, 89],
    "test": [90, 99]
  },
  "sources": [],
  "assets": []
}
